{
  "name": "Product NFT - Turbine Blade CLX-2026-001",
  "description": "IOTA Digital Product Passport for a manufactured turbine blade.",
  "serialNumber": "CLX-2026-001",
  "manufacturer": "Foundry ABC",
  "materialBatch": "IN718-HEAT-45678",
  "heatNumber": "HT-2026-089",
  "nftKind": "Product",
  "currentLifecycleStage": "ManufacturingAndInspection",
  "createdAt": "2026-05-12T16:15:01.156Z",
  "updatedAt": "2026-05-12T16:15:01.156Z",
  "physicalBinding": {
    "qrPayload": "iota-dpp://1076/0xCONTRACT/1",
    "nfcTagId": "NFC-UFG-0001",
    "machineId": "CNC-MACHINE-01"
  },
  "semantic": {
    "ontologyUri": "ipfs://replace-with-ontology-cid",
    "rdfClass": "ManufacturingComponent",
    "knowledgeGraphNode": "urn:ufg:dpp:CLX-2026-001",
    "reasoningResultUri": "ipfs://replace-with-reasoning-result-cid"
  },
  "analytics": {
    "modelVersion": "rul-model-v0.1",
    "remainingUsefulLife": 0.87,
    "anomalyScore": 0.06,
    "rootCause": "No defect detected",
    "recommendation": "Continue manufacturing cycle"
  },
  "metaverseValidation": {
    "scenarioId": "DT-SIM-2026-001",
    "result": "Approved",
    "riskScore": 0.08,
    "artifactUri": "ipfs://replace-with-metaverse-validation-cid"
  },
  "history": [
    {
      "eventType": "ManufacturingStep",
      "timestamp": "2026-05-12T16:15:01.156Z",
      "artifactUri": "ipfs://replace-with-process-report-cid",
      "artifactHash": "0xreplace",
      "submittedBy": "0x0000000000000000000000000000000000000000"
    }
  ]
}